{
  "name": "nfcu_advanced_controls",
  "description_prefix": "Description:",
  "legacy_section_headings": {
    "Impact of Implementation:": "impact",
    "Risk of Non-Implementation:": "risk",
    "Pre-requisites:": null,
    "Permissions:": "permissions",
    "Resources / Environmental Configuration:": "resources",
    "Configuration Steps": "steps",
    "Exception Management:": "exception"
  },
  "default_exception_text": "Any resource requiring an exception to this control must follow Navy Federal Credit Union's Document 2626.1, Security Issues and Exceptions Management Security Standard.",
  "default_exception_bullets": [
    "Scope: Specific resource(s) and environment(s) covered by the exception.",
    "Business Justification: Documented technical or operational reason the control cannot be applied.",
    "Compensating Controls: Alternative detective, preventive, or governance controls that reduce the same risk.",
    "Approvals: Sign-off from Security Architecture, the AI Risk Champion, and the accountable business owner.",
    "Expiration: A defined end date for the exception, with renewal or closure required before expiry.",
    "Monitoring: Ongoing review of the excepted resource and documented acknowledgement of any related alerts or findings."
  ],
  "metadata_static": {
    "version": "1.1",
    "status": "DRAFT \u2014 Migrated from legacy advanced control",
    "last_updated": "May 2026",
    "owner": "[Security Architecture Team]"
  },
  "title_table_text": "ADVANCED CONTROL DOCUMENT | {title} | {domain}",
  "output_name_template": "{stem}.docx",
  "default_theme": "copilot-governance",
  "default_control_type": "Advanced Control",
  "control_type_rules": [
    {
      "label": "Advanced Detective Control",
      "keywords": ["monitor", "detect", "alert", "logging", "audit", "inventory"]
    },
    {
      "label": "Advanced Preventive Control",
      "keywords": ["disable", "restrict", "block", "enforce", "prevent"]
    }
  ],
  "theme_keywords": [
    { "theme": "foundry-guardrails", "keywords": ["guardrail", "foundry"], "match": "any" },
    { "theme": "purview-dlp", "keywords": ["data leakage", "m365 copilot", "dlp"], "match": "any" },
    { "theme": "copilot-audit", "keywords": ["audit", "copilot studio"], "match": "all" },
    { "theme": "dataverse-audit", "keywords": ["dataverse"], "match": "any" },
    { "theme": "copilot-governance", "keywords": ["publishing", "cross-geography", "credentials", "authentication"], "match": "any" },
    { "theme": "ai-inventory", "keywords": ["inventory", "defender"], "match": "any" },
    { "theme": "ai-threat", "keywords": ["threat", "alerting", "application insights", "sentinel"], "match": "any" }
  ],
  "themes": {
    "foundry-guardrails": {
      "domain": "AI Runtime Security / AI Governance",
      "platforms": "Microsoft Foundry, Azure Policy, Microsoft Sentinel",
      "mitre": "ML Model Evasion, Prompt Injection, Inhibit Response Function",
      "owasp": "LLM01: Prompt Injection, LLM07: Insecure Plugin Design",
      "regulatory": "EU AI Act Article 9, NIST AI RMF GOVERN 1.2, ISO/IEC 42001",
      "rationale": "This is an advanced control because it governs model and agent safety settings at the platform layer and combines preventive policy enforcement with detective monitoring and compliance visibility.",
      "capabilities": [
        "Mandates guardrail controls and policy compliance checks for model or agent deployments.",
        "Collects compliance or activity signals into centralized monitoring workflows.",
        "Provides an auditable path to detect exceptions, drift, or bypass attempts."
      ],
      "official_refs": [
        "Manage compliance and security in Microsoft Foundry \u2014 https://learn.microsoft.com/azure/foundry/control-plane/how-to-manage-compliance-security",
        "Quickstart: Create a guardrail policy \u2014 https://learn.microsoft.com/azure/foundry/control-plane/quickstart-create-guardrail-policy",
        "Guardrails and controls overview in Microsoft Foundry \u2014 https://learn.microsoft.com/azure/foundry/guardrails/guardrails-overview",
        "How to configure guardrails and controls in Microsoft Foundry \u2014 https://learn.microsoft.com/azure/foundry/guardrails/how-to-create-guardrails",
        "Threat detection in Microsoft Sentinel \u2014 https://learn.microsoft.com/azure/sentinel/threat-detection"
      ],
      "research_refs": [
        "MITRE ATLAS \u2014 https://atlas.mitre.org/",
        "OWASP Top 10 for LLM Applications \u2014 https://genai.owasp.org/llm-top-10/",
        "NIST AI Risk Management Framework \u2014 https://www.nist.gov/itl/ai-risk-management-framework"
      ]
    },
    "purview-dlp": {
      "domain": "AI Data Protection / Monitoring",
      "platforms": "Microsoft Purview, Microsoft Sentinel, Microsoft 365 Copilot",
      "mitre": "Collection, Exfiltration, Sensitive Data Exposure",
      "owasp": "LLM02: Sensitive Information Disclosure, LLM06: Excessive Agency",
      "regulatory": "GLBA, PCI DSS, NIST AI RMF MAP/MEASURE, ISO/IEC 42001",
      "rationale": "This is an advanced control because it combines data protection policy, audit telemetry, and downstream security operations monitoring across multiple Microsoft security services.",
      "capabilities": [
        "Monitors sensitive data handling in Copilot interactions through Microsoft Purview.",
        "Routes relevant audit and protection signals into Microsoft Sentinel for investigation.",
        "Supports tuning, escalation, and evidentiary review for potential data leakage events."
      ],
      "official_refs": [
        "Integrate Microsoft Sentinel and Microsoft Purview \u2014 https://learn.microsoft.com/azure/sentinel/purview-solution",
        "Start ingesting Microsoft Purview data in Microsoft Sentinel \u2014 https://learn.microsoft.com/azure/sentinel/purview-solution#start-ingesting-microsoft-purview-data-in-microsoft-sentinel",
        "Microsoft Purview service description for Microsoft 365 Copilot DLP \u2014 https://learn.microsoft.com/office365/servicedescriptions/microsoft-365-service-descriptions/microsoft-365-tenantlevel-services-licensing-guidance/microsoft-purview-service-description#microsoft-purview-data-loss-prevention-dlp-for-microsoft-365-copilot",
        "Configure a secure and governed foundation for Microsoft 365 Copilot \u2014 https://learn.microsoft.com/microsoft-365/copilot/configure-secure-governed-data-foundation-microsoft-365-copilot#step-2-set-up-guardrails",
        "How data is protected and audited in Microsoft 365 and Microsoft 365 Copilot \u2014 https://learn.microsoft.com/microsoft-365/copilot/microsoft-365-copilot-architecture-data-protection-auditing"
      ],
      "research_refs": [
        "MITRE ATLAS \u2014 https://atlas.mitre.org/",
        "OWASP Top 10 for LLM Applications \u2014 https://genai.owasp.org/llm-top-10/",
        "NIST AI Risk Management Framework \u2014 https://www.nist.gov/itl/ai-risk-management-framework"
      ]
    },
    "copilot-audit": {
      "domain": "AI Governance / Auditability",
      "platforms": "Microsoft Purview, Copilot Studio, Microsoft 365",
      "mitre": "Audit Trail Collection, Privileged Activity Monitoring",
      "owasp": "LLM08: Excessive Functionality, LLM10: Model Theft / Governance Gaps",
      "regulatory": "NIST AI RMF GOVERN, SOC 2 CC7, ISO/IEC 42001",
      "rationale": "This is an advanced control because it extends beyond baseline logging and builds centralized evidence for administrative, maker, and user activity across AI-enabled workflows.",
      "capabilities": [
        "Captures administrative, maker, and user AI activity in Microsoft Purview.",
        "Provides searchable evidence for incident response, compliance review, and forensics.",
        "Improves visibility into agent changes and user interactions that affect AI risk posture."
      ],
      "official_refs": [
        "Audit Copilot Studio activities in Microsoft Purview \u2014 https://learn.microsoft.com/microsoft-copilot-studio/admin-logging-copilot-studio",
        "Access the logs for Copilot Studio activities \u2014 https://learn.microsoft.com/microsoft-copilot-studio/admin-logging-copilot-studio#access-the-logs",
        "Audit logs for Copilot and AI applications \u2014 https://learn.microsoft.com/purview/audit-copilot",
        "Use Microsoft Purview to manage data security and compliance for Microsoft Copilot Studio \u2014 https://learn.microsoft.com/purview/ai-copilot-studio",
        "Audit log activities for Microsoft 365 Copilot admin activities \u2014 https://learn.microsoft.com/purview/audit-log-activities#microsoft-365-copilot-admin-activities"
      ],
      "research_refs": [
        "MITRE ATLAS \u2014 https://atlas.mitre.org/",
        "NIST AI Risk Management Framework \u2014 https://www.nist.gov/itl/ai-risk-management-framework",
        "Microsoft Cloud Security Benchmark AI Security \u2014 https://learn.microsoft.com/security/benchmark/azure/mcsb-v2-artificial-intelligence-security"
      ]
    },
    "dataverse-audit": {
      "domain": "Power Platform Security Monitoring / Auditability",
      "platforms": "Microsoft Dataverse, Microsoft Purview, Microsoft Sentinel",
      "mitre": "Collection, Audit Trail Monitoring, Data Access Monitoring",
      "owasp": "LLM02: Sensitive Information Disclosure, LLM06: Excessive Agency",
      "regulatory": "DPIA support requirements, NIST AI RMF GOVERN, ISO/IEC 42001",
      "rationale": "This is an advanced control because it links application-layer auditing, platform-level configuration, and SOC-facing monitoring for Power Platform workloads.",
      "capabilities": [
        "Turns on environment-level and table-level auditing for Dataverse-backed workloads.",
        "Makes activity visible in Microsoft Purview and, where applicable, Microsoft Sentinel.",
        "Creates a consistent investigation trail for data changes, exports, and user actions."
      ],